{
  "algorithm": "ed25519",
  "key_id": "rk-release-2026-09",
  "schema_version": "1.0",
  "signature": "+wpU3LPSLAoupu3g15wgd5meOnbD33wViTaPOxk8MXS80gi0k/+RDjxVYNkBV0jJ5f5q3DgPqCCcJLHlLm9oDA==",
  "signed_file": "m6-20260918-kv_cache_append-gfx1151-prefill-t128-mha32-d128-p32-bf16.json",
  "signed_sha256": "cacd469e630ef40b5540a07f6915fc81415cff3cc1deba2b62e2ed3d5738f8fc"
}
