{
  "algorithm": "ed25519",
  "key_id": "rk-release-2026-09",
  "schema_version": "1.0",
  "signature": "OEPXQfMfOhjICy/M1d3vFY3hIhZg7w8x3LMXX/r9slEtYo1Y264bMIIElNO0tWi+i6TwfMX2zfvWby2IlNSBAg==",
  "signed_file": "m6-20260918-kv_cache_append-gfx1151-prefill-t128-mha32-d128-p32-fp16.json",
  "signed_sha256": "ce130d274dc161be165e3e4608b060fa344f07d767197ff5a90963691e643883"
}
