{
  "algorithm": "ed25519",
  "key_id": "rk-release-2026-09",
  "schema_version": "1.0",
  "signature": "KnzFlBWF1jeI6oAiXhQcl2/Rhp9tmSEQ763qV3mXv5ofrUjWcAuN5WOo1DzTBpL2ENj3EAE7pRoELkM0rWjSBg==",
  "signed_file": "m6-20260918-kv_cache_copy-gfx1151-beam-pairs1-gqa8-d128-p16-fp16.json",
  "signed_sha256": "e26a8dbc02d34b94f9346c5b5a1099d641a17994d714b4791cfafee2401308a2"
}
